{
  "case_id": "qwen_tiny_room_001",
  "schema_version": "2.0",
  "input_level": "structured_relation",
  "description": {
    "text": "Generate a simple 3D room layout with one desk, one chair, and one bookshelf. Keep the chair near and facing the desk.",
    "room_type": "study",
    "tags": ["qwen-text-smoke", "small"]
  },
  "room": {
    "unit": "meter",
    "boundary": [[0, 0], [4, 0], [4, 3], [0, 3]],
    "floor_z": 0.0,
    "wall_height": 2.8
  },
  "objects": [
    {
      "id": "desk_1",
      "category": "desk",
      "bbox_size": [1.2, 0.6, 0.75],
      "required": true,
      "source": "synthetic-qwen-smoke"
    },
    {
      "id": "chair_1",
      "category": "chair",
      "bbox_size": [0.55, 0.55, 0.85],
      "required": true,
      "source": "synthetic-qwen-smoke"
    },
    {
      "id": "bookshelf_1",
      "category": "bookshelf",
      "bbox_size": [0.8, 0.35, 1.8],
      "required": true,
      "source": "synthetic-qwen-smoke"
    }
  ],
  "relations": [
    {
      "id": "rel_001",
      "type": "near",
      "subject": "chair_1",
      "object": "desk_1",
      "visible_to_model": true,
      "source": "synthetic-qwen-smoke"
    },
    {
      "id": "rel_002",
      "type": "facing",
      "subject": "chair_1",
      "object": "desk_1",
      "visible_to_model": true,
      "source": "synthetic-qwen-smoke"
    }
  ],
  "source": {
    "dataset": "synthetic-qwen-smoke"
  }
}
