{
  "task_id": "living_room_001",
  "input_mode": "text_room_boundary_objects",
  "scene_prompt": "Create a compact living room with a sofa, coffee table, TV stand, floor lamp, and bookshelf.",
  "room": {
    "unit": "meter",
    "floor_polygon": [[0, 0], [6, 0], [6, 4.5], [0, 4.5]],
    "floor_z": 0.0,
    "wall_height": 2.8
  },
  "required_objects": ["sofa", "coffee_table", "tv_stand", "floor_lamp", "bookshelf"],
  "spatial_constraints": [
    {
      "type": "near",
      "source_category": "coffee_table",
      "target_category": "sofa",
      "hard": false
    },
    {
      "type": "facing",
      "source_category": "sofa",
      "target_category": "tv_stand",
      "hard": false
    },
    {
      "type": "against_wall",
      "source_category": "bookshelf",
      "target": "any_wall",
      "hard": false
    }
  ],
  "hidden_annotations": {
    "expected_objects": [],
    "expected_relations": [],
    "attachment_rules": []
  }
}
